{
  "id": "voluptate fugiat",
  "customerStatus": "irure elit fugiat",
  "marketingEmailResponseRate": 50705470,
  "totalContractedAmount": 8126281,
  "last24MonthsNewRevenueAmount": -93209387,
  "originatingCustomerSource": "commodo",
  "auditDetail": {
    "createdOn": "2005-04-27T08:55:55.744Z",
    "createdBy": "dolor in commodo eiusmod",
    "updatedOn": "1955-01-10T02:10:13.819Z",
    "updatedBy": "fugiat",
    "isDeleted": true
  },
  "last12MonthsNewRevenueAmount": 77273134
}
