{
  "id": "nostrud esse exercitation",
  "customerStatus": "irure",
  "totalContractedAmount": -92357243,
  "last12MonthsNewRevenueAmount": 77454523,
  "last12MonthsSupportCallCount": -25789889,
  "originatingCustomerSource": "aute officia ullamco",
  "prospectRating": "adipisicing magna",
  "marketingEmailResponseRate": 66675153,
  "netPromoterScore": -96018544,
  "last24MonthsNewRevenueAmount": 19544419,
  "party": [
    "tempor minim eu",
    "consequat officia est commodo",
    "labore",
    "cillum nostrud cupidatat",
    "deserunt",
    "consectetur irure tempor ad sed",
    "ullamco est consectetur tempor officia",
    "ipsum",
    "officia deserunt occaecat ex",
    "id sit mollit in",
    "voluptate ut",
    "dolor in in mollit",
    "irure ipsum ut deserunt",
    "quis officia in Lorem",
    "veniam consequat",
    "minim officia non commodo",
    "proident occaecat labore",
    "sunt incididunt quis consectetur eiusmod",
    "nisi laboris ut",
    "eu occaecat",
    "velit est deserunt fugiat consequat",
    "dolor",
    "quis dolore labore sit eu",
    "cupidatat ut consequat Duis",
    "fugiat et proident",
    "Excepteur",
    "labore Excepteur",
    "qui enim eiusmod",
    "reprehenderit quis occaecat"
  ],
  "totalProfitContributionAmount": -1037375
}
